Tensp,giatu,giaden,daban,diadiem,Column6,Column7,gia goc,giam,link
Sữa rửa mặt COSRX Salicylic Axit 0.5% 150ml tái tạo da hiệu quả,-,85000,"Đã bán 28,4k",Hàn Quốc,,₫,367000,,https://down-vn.img.susercontent.com/file/vn-11134201-7r98o-lmxb3nzk9l277b_tn
[Đủ bill Mua hàng] Kem Chống Nắng Phổ Rộng Heliocare SPF50+,-,385000,"Đã bán 7,9k",Bình Dương,,₫,645000,,https://down-vn.img.susercontent.com/file/vn-11134207-7r98o-ls2qz9dvupqcd8_tn
Kem Dưỡng Trắng Làm Mờ Đốm Nâu Laneige Radian-C Cream 50ml,1200000,895000,"Đã bán 17,8k",TP. Hồ Chí Minh,Mua Kèm Deal Sốc,,,10% Giảm,https://down-vn.img.susercontent.com/file/vn-11134207-7qukw-li71ukbrsfde94_tn
Sữa rửa mặt SVR SEBIACLEAR Gel Moussant 55ml/400ml,-,105000,"Đã bán 8,5k",TP. Hồ Chí Minh,Mua Kèm Deal Sốc,₫,399000,,https://down-vn.img.susercontent.com/file/65b1372939e569e7d34a4dd2546b0f65_tn
[Mẫu mới] Kem dưỡng ẩm La Roche Posay Cicaplast Baume B5+,-,245000,"Đã bán 35,1k",TP. Hồ Chí Minh,,₫,380000,,https://down-vn.img.susercontent.com/file/d8dea2a2d41c66d64101a8aeaca73cdb_tn
[Chỉ còn 167Ksau voucher] Bộ sản phẩm 02 Kem chống nắng dạng sữa Senka Perfect UV Milk 40ml,,418000,Đã bán 861,TP. Hồ Chí Minh,,,,,https://down-vn.img.susercontent.com/file/vn-11134207-7r98o-ls3nfiyrek78a3_tn
Tinh chất cấp ẩm hồi phục The Ordinary Hyaluronic Acid 2% + B5,-,240000,"Đã bán 116,6k",TP. Hồ Chí Minh,,₫,425000,,https://down-vn.img.susercontent.com/file/vn-11134207-7r98o-lrx5kgl1md387d_tn
[HB GIFT] Bộ 4 Mặt nạ ngủ dưỡng ẩm cho da Laneige Water Sleeping Mask 15mlx4,,680000,"Đã bán 21,2k",TP. Hồ Chí Minh,,,,10% Giảm,https://down-vn.img.susercontent.com/file/vn-11134207-7r98o-lqy60dbyukec9a_tn
"Bột Đắp Mặt Nạ Ngăn Ngừa Mụn, Dưỡng Da Trắng Mịn MILAGANICS 100g (Túi Zip)",-,19000,"Đã bán 58,5k",TP. Hồ Chí Minh,,₫,49000,50% Giảm,https://down-vn.img.susercontent.com/file/23c72d10bcb3a99e5562fd5a461c88c6_tn
[Duy nhất 25.1 - Giá chỉ còn 150500Đ] Combo Simple Tẩy trang 200ml + Sữa rửa mặt 150ml + Nước hoa hồng 200ml,,399000,Đã bán 3k,TP. Hồ Chí Minh,,,,,https://down-vn.img.susercontent.com/file/vn-11134207-7qukw-lj0td18nflxuf4_tn
Kem dưỡng Olay 7 in 1 bản uk ban ngày và ban đêm cao cấp,-,287500,Đã bán 1,Hà Nội,,₫,500000,Giảm ₫8k,https://down-vn.img.susercontent.com/file/vn-11134207-7r98o-lqu5vdqnaa4y78_tn
Kem Giảm Thâm Mụn SANTAGIFT SPF30 - Trắng sáng - Ức chế sắc tố - Chống nắng - 20g,-,99000,Đã bán 17k,TP. Hồ Chí Minh,Mua Kèm Deal Sốc,₫,134000,,https://down-vn.img.susercontent.com/file/vn-11134207-7r98o-ls1lb0ln7hqx45_tn
(QUÀ TẶNG LÌ XÌ) Gel tẩy tế bào chết Rosette Peeling Gel từ AHA trái cây tự nhiên Nhật Bản (No.1 Cosme) - Bahachiha,-,88000,"Đã bán 1,8k",Hà Nội,,₫,150000,,https://down-vn.img.susercontent.com/file/cn-11134207-7r98o-lokxja96v13u61_tn
Mặt nạ Bivota mặt nạ dưỡng da trắng da cấp ẩm thải độc da nội địa trung B89,-,1900,"Đã bán 3,1k",Hà Nội,Mua để nhận quà,₫,2500,,https://down-vn.img.susercontent.com/file/vn-11134207-7qukw-lgxawf3i6rxv09_tn
Kem Chống Nắng The Saem Eco Earth Power Pink Sun Cream EX SPF50++++,-,57500,"Đã bán 1,7k",Hà Nội,,₫,115000,,https://down-vn.img.susercontent.com/file/vn-11134207-7r98o-lrwwadptvikk77_tn
[Mã ICBTUE251 giảm 25K đơn 149K] kem hỗ trợ giảm mụn URI - DERLUMAX,-,189000,"Đã bán 1,3k",Bình Định,Mua để nhận quà,₫,499000,10% Giảm,https://down-vn.img.susercontent.com/file/vn-11134207-7r98o-lr78ngc942vt4f_tn
Gel chấm giảm mụn Dr.PONG 28H Whitening Drone Acne Clear Spot 10g,,199000,"Đã bán 5,1k",TP. Hồ Chí Minh,,,,Giảm ₫35k,https://down-vn.img.susercontent.com/file/vn-11134207-7r98o-lpzxb8jiv9yv23_tn
kem dưỡng Ẩm giảm mụn la roche-posay effaclar duo+ 40ml trị thâm mụn Kem Giảm Mụn,-,235000,Đã bán 709,Hà Nội,,₫,460000,20% Giảm,https://down-vn.img.susercontent.com/file/vn-11134207-7r98o-lqu0k9cgm1g2a2_tn
