Tensp,giatu,giaden,daban,diadiem,Column6,Column7,gia goc,giam,link
Kuzhen Mặt Nạ Nâng Cơ Mặt Tạo Cằm Chữ v Thon Gọn,35152,25000,"Đã bán 8,8k",Nước ngoài,,,,,https://down-vn.img.susercontent.com/file/vn-11134207-7r98o-ls1lb0ln7hqx45_tn
Mặt Nạ Trái Cây Bioaqua Mask Dưỡng Trắng Cấp Ẩm Căng Bóng- Cung Cấp Vitamin Cho Làn Da Khỏe Đẹp,-,2800,"Đã bán 227,1k",TP. Hồ Chí Minh,Mua để nhận quà,₫,4000,,https://down-vn.img.susercontent.com/file/cn-11134207-7r98o-lokxja96v13u61_tn
"Serum Dưỡng Sáng, Phục Hồi Cho Da Dầu Mụn, Nhạy Cảm Niacinamide 10% + Arbutin 2% Tia'm Vita B3 Source 40ml",659000,372000,"Đã bán 9,4k",TP. Hồ Chí Minh,,,,Giảm ₫10k,https://down-vn.img.susercontent.com/file/vn-11134207-7qukw-lgxawf3i6rxv09_tn
"Mascara dưỡng mi giữ ẩm, dài mi từ dầu dừa nguyên chất 5ml JULYHOUSE",-,29000,"Đã bán 54,4k",TP. Hồ Chí Minh,,₫,109000,,https://down-vn.img.susercontent.com/file/vn-11134207-7r98o-lrwwadptvikk77_tn
Kem Chống Nẻ - Kem Dưỡng Ẩm Chống Nứt Nẻ Da Heyxi 20g,40000,15000,Đã bán 32k,Thanh Hóa,,,,,https://down-vn.img.susercontent.com/file/vn-11134207-7r98o-lr78ngc942vt4f_tn
Mặt Nạ Giấy Banobagi Mask Retinol Collagen Vitamin Viên Thuốc Dưỡng Trắng Da Mặt Cấp Ẩm Giảm Mụn Kiềm Dầu 30ml,-,7900,"Đã bán 12,8k",TP. Hồ Chí Minh,Mua để nhận quà,₫,15900,,https://down-vn.img.susercontent.com/file/vn-11134207-7r98o-lpzxb8jiv9yv23_tn
🔥HOT🔥Sữa Rửa Mặt Chiết Xuất Bơ Hữu Cơ Dưỡng Ẩm Không Gây Kích Ứng HZMBB1592,24000,11000,"Đã bán 3,7k",Nước ngoài,Mua Kèm Deal Sốc,,,,https://down-vn.img.susercontent.com/file/vn-11134207-7r98o-lqu0k9cgm1g2a2_tn
"SỮA RỬA MẶT LA ROCHE POSAY CHO DA DẦU, MỤN, NHẠY CẢM EFFACLAR PURIFYING FOAMING GEL CHÍNH HÃNG 100%",-,51900,"Đã bán 14,1k",TP. Hồ Chí Minh,Mua Kèm Deal Sốc,₫,429000,,https://down-vn.img.susercontent.com/file/vn-11134207-7qukw-ljhxtw7zzhfmbd_tn
Kem Chống Nắng Skin1004 Madagascar Centella Air-Fit Suncream Plus 50ml,-,119000,"Đã bán 24,4k",TP. Hồ Chí Minh,,₫,276000,,https://down-vn.img.susercontent.com/file/d0eaa8cd5feedc893992bb358ddf639f_tn
"Sữa rửa mặt dạng gel sạch thoáng dịu nhẹ Garnier 2% [BHA, Vitamin C] cho da dầu mụn 120ml",169000,149000,"Đã bán 11,3k",TP. Hồ Chí Minh,Mua để nhận quà,,,Giảm ₫25k,https://down-vn.img.susercontent.com/file/vn-11134207-7r98o-lrs1u32e0bkp1f_tn
[Loại 150ml] Sữa Rửa Mặt Cosrx Low PH Good Morning Gel Cleanser Dạng Gel Chiết Từ Dầu Cây Trà,180000,123000,Đã bán 128k,Hà Nội,,,,,https://down-vn.img.susercontent.com/file/3618317c063f736f9b0f28a78da31d6b_tn
Kem Chống Nắng Chiết Xuất Rau Má Skin1004 SPF50+ PA++++ 50ml Hasaki Sản Phẩm Chính Hãng,425000,276000,"Đã bán 15,5k",TP. Hồ Chí Minh,,,,Giảm ₫5k,https://down-vn.img.susercontent.com/file/vn-11134207-7qukw-lijykai6gyks5f_tn
Combo Simple Nước tẩy trang 200ml + Sữa rửa mặt 150ml + Nước hoa hồng 200ml + Sữa dưỡng dạng sữa 125ml,557000,282000,"Đã bán 5,8k",Bắc Ninh,Mua Kèm Deal Sốc,,,,https://down-vn.img.susercontent.com/file/vn-11134201-7r98o-lmxb3nzk9l277b_tn
Serum dưỡng sáng mờ thâm nám L'Oreal Paris Glycolic Bright 1.0% Glycolic Acid (AHA) 30ml,429000,373000,"Đã bán 58,8k",TP. Hồ Chí Minh,,,,10% Giảm,https://down-vn.img.susercontent.com/file/vn-11134207-7r98o-ls2qz9dvupqcd8_tn
Mặt Nạ Giấy Dưỡng Da Cấp Ẩm Trắng Da Ngừa Mụn Thải Độc Mask Đắp Mặt HA IMAGES Nội Địa Trung MOCHI SHOP Trà Xanh,-,3000,"Đã bán 115,1k",TP. Hồ Chí Minh,,₫,4800,,https://down-vn.img.susercontent.com/file/vn-11134207-7qukw-li71ukbrsfde94_tn
"Sữa chống nắng dưỡng da ngừa mụn Sunplay Skin Aqua Acne Clear SPF 50, PA++++ 25g",122000,109000,"Đã bán 18,4k",TP. Hồ Chí Minh,Mua để nhận quà,,,Giảm ₫10k,https://down-vn.img.susercontent.com/file/65b1372939e569e7d34a4dd2546b0f65_tn
Sữa Chống Nắng Anessa Cho Da Nhạy Cảm & Trẻ Em 60ml Perfect UV Sunscreen Mild Milk (For Sensitive Skin) SPF50+/PA++++,715000,441000,"Đã bán 10,5k",TP. Hồ Chí Minh,,,,Giảm ₫5k,https://down-vn.img.susercontent.com/file/d8dea2a2d41c66d64101a8aeaca73cdb_tn
Sữa Rửa Mặt Dịu Nhẹ Cho Da Nhạy Cảm Eucerin pH5 Sensitive Skin Facial Cleanser 100ml,109000,103000,"Đã bán 5,3k",TP. Hồ Chí Minh,Mua để nhận quà,,,,https://down-vn.img.susercontent.com/file/3618317c063f736f9b0f28a78da31d6b_tn
Kem chống nắng BEPLAIN Sunmuse lai Vật Lý & Hoá Học Nâng Tone & Hiệu chỉnh da SPF 50+ PA++++ 50mL,560000,330000,"Đã bán 11,7k",Hàn Quốc,,,,15% Giảm,https://down-vn.img.susercontent.com/file/vn-11134207-7qukw-lijykai6gyks5f_tn
Sữa rửa mặt CeraVe dành cho da thường và da khô CeraVe Foaming Facial Cleanser 236ml,,280000,"Đã bán 2,4k",Hà Nội,,,,Giảm ₫25k,https://down-vn.img.susercontent.com/file/vn-11134201-7r98o-lmxb3nzk9l277b_tn
Mặt nạ dưỡng da Vita Genic Jelly Mask BANOBAGI 30ml,19000,13000,"Đã bán 13,6k",Hà Nội,,,,,https://down-vn.img.susercontent.com/file/vn-11134207-7r98o-ls2qz9dvupqcd8_tn
Sữa Rửa Mặt Compliment No Problem ngăn ngừa mụn sạch sâu 200ml,-,75000,"Đã bán 2,9k",TP. Hồ Chí Minh,,₫,100000,,https://down-vn.img.susercontent.com/file/vn-11134207-7qukw-li71ukbrsfde94_tn
Toner Pad BEPLAIN Cicaterol làm dịu & sáng da 180ml (70 miếng),530000,330000,"Đã bán 1,7k",Hàn Quốc,,,,15% Giảm,https://down-vn.img.susercontent.com/file/65b1372939e569e7d34a4dd2546b0f65_tn
Sữa rửa mặt trắng da Hatomugi Cleansing Foam hạt Ý Dĩ,-,39000,"Đã bán 97,7k",Hà Nội,,₫,60000,,https://down-vn.img.susercontent.com/file/d8dea2a2d41c66d64101a8aeaca73cdb_tn
Nước hoa hồng Pyunkang Yul Essence Toner 30ml-200ml,-,55000,Đã bán 6k,TP. Hồ Chí Minh,Mua Kèm Deal Sốc,₫,235000,,https://down-vn.img.susercontent.com/file/vn-11134207-7r98o-ls3nfiyrek78a3_tn
Gel Nha Đam Dưỡng Ẩm & Làm Mềm Da - Gel Lô Hội 98% Aloe Vera Gel MILAGANICS 300ml (Hũ),-,25000,"Đã bán 53,2k",TP. Hồ Chí Minh,,₫,119000,50% Giảm,https://down-vn.img.susercontent.com/file/vn-11134207-7r98o-lrx5kgl1md387d_tn
[Bill 189k - Mua 1 Tặng 1] Kem Rửa Mặt Hada Labo Sạch Sâu Dưỡng Ẩm 80g Hasaki Sản Phẩm Chính Hãng,79000,76000,"Đã bán 39,5k",TP. Hồ Chí Minh,Mua để nhận quà,,,,https://down-vn.img.susercontent.com/file/vn-11134207-7r98o-lqy60dbyukec9a_tn
Tinh Chất Rau Má Giảm Mụn Và Làm Dịu Dành Cho Da Nhạy Cảm Skin1004 Madagascar Centella Ampoule 30ml/55ml/100ml,-,149000,"Đã bán 21,3k",TP. Hồ Chí Minh,Mua Kèm Deal Sốc,₫,397000,,https://down-vn.img.susercontent.com/file/23c72d10bcb3a99e5562fd5a461c88c6_tn
"Mặt Nạ Dưỡng Da, Cấp Ẩm FoodAHolic 23g [ Lam Thảo Cosmetics - Sản Phẩm Chính Hãng ]",-,9000,"Đã bán 150,1k",TP. Hồ Chí Minh,,₫,23000,,https://down-vn.img.susercontent.com/file/vn-11134207-7qukw-lj0td18nflxuf4_tn
làm dài và dày mi với Biotin Peptides và Chiết xuất nhân sâm - 2 in 1 Lash Brow Serum The Originote,119000,75000,"Đã bán 38,3k",TP. Hồ Chí Minh,,,,Giảm ₫5k,https://down-vn.img.susercontent.com/file/vn-11134207-7r98o-lqu5vdqnaa4y78_tn
"Tinh chất Dear, Klairs Freshly Juiced Vitamin Drop 35ml",455000,318500,"Đã bán 40,6k",Hà Nội,,,,,https://down-vn.img.susercontent.com/file/vn-11134207-7r98o-ls1lb0ln7hqx45_tn
"N80 Gel Tẩy Tế Bào Chết, Tẩy Da Chết Dành Cho Da Mặt Chiết Xuất Chanh Tươi 120gr",-,7500,"Đã bán 25,5k",Hà Nội,,₫,29000,,https://down-vn.img.susercontent.com/file/cn-11134207-7r98o-lokxja96v13u61_tn
"Kem chống tia UV, chống nắng Sun Treatment SPF 50+",-,13988,"Đã bán 18,2k",Nước ngoài,Mua Kèm Deal Sốc,₫,18888,,https://down-vn.img.susercontent.com/file/vn-11134207-7qukw-lgxawf3i6rxv09_tn
"Megaduo Gel/Plus Gamma 15g-30g, Gel Giảm Mụn Ẩn, Thâm, Đầu Đen Cho Da Dầu Mụn - Dr Thêm",-,126000,Đã bán 117k,Hà Nội,,₫,135000,,https://down-vn.img.susercontent.com/file/vn-11134207-7r98o-lrwwadptvikk77_tn
Numbuzin Số 5 + Đệm Cô Đặc Vitamin-Niacinamide 180ml / 70 Miếng,533330,373331,Đã bán 4k,Hàn Quốc,Mua để nhận quà,,,,https://down-vn.img.susercontent.com/file/vn-11134207-7r98o-lr78ngc942vt4f_tn
"Sữa rửa mặt không có xà phòng, làm sạch và loại bỏ tế bào da chết SVR SEBIACLEAR GEL MOUSSANT 55ml",140000,125000,"Đã bán 12,7k",TP. Hồ Chí Minh,,,,,https://down-vn.img.susercontent.com/file/vn-11134207-7r98o-lpzxb8jiv9yv23_tn
Kem chống nắng vật lý kiềm dầu Make P:rem UV defense me. No sebum sun cream 50ml,-,100000,"Đã bán 4,8k",Hà Nội,,₫,360000,,https://down-vn.img.susercontent.com/file/vn-11134207-7r98o-lqu0k9cgm1g2a2_tn
Lẻ Kem Xù - Dnow - Sâm Vàng - Bl - Emon - BHN rojzy -BHĐ SHEENA - ac Thái - ac Mỹ - Pop .v.v.v.,-,2500,"Đã bán 33,4k",TP. Hồ Chí Minh,Mua Kèm Deal Sốc,₫,10000,10% Giảm,https://down-vn.img.susercontent.com/file/vn-11134207-7qukw-ljhxtw7zzhfmbd_tn
Sữa rửa mặt không gây kích ứng cho da nhạy cảm Eucerin pH5 Facial Cleanser 400ml,279000,229000,"Đã bán 47,8k",TP. Hồ Chí Minh,Mua để nhận quà,,,,https://down-vn.img.susercontent.com/file/d0eaa8cd5feedc893992bb358ddf639f_tn
Mặt nạ lột MEDIPEEL Red Lacto Collagen Wrapping Mask 70g,735000,460000,"Đã bán 3,2k",Hàn Quốc,,,,13% Giảm,https://down-vn.img.susercontent.com/file/vn-11134207-7r98o-lrs1u32e0bkp1f_tn
FOCALLURE Miếng Dán Mụn Tái Tạo Chăm Sóc Làn Da 2g,16000,15000,"Đã bán 8,4k",TP. Hồ Chí Minh,Mua Kèm Deal Sốc,,,,https://down-vn.img.susercontent.com/file/3618317c063f736f9b0f28a78da31d6b_tn
"Gel Tẩy Nốt Ruồi DVELINIL Nga Tẩy Nốt Ruồi, Mụn Cơm, Mụn Cóc, Mụn Thịt",-,39000,Đã bán 67k,Hà Nội,,₫,89000,,https://down-vn.img.susercontent.com/file/vn-11134207-7qukw-lijykai6gyks5f_tn
"(BILL CANADA) Tinh chất, serum hỗ trợ giảm mụn, thu nhỏ lỗ chân lông Niacinamide 10% + Zinc 1% - The Ordinary.",-,169000,"Đã bán 57,4k",TP. Hồ Chí Minh,,₫,319000,,https://down-vn.img.susercontent.com/file/vn-11134201-7r98o-lmxb3nzk9l277b_tn
Mặt Nạ Banobagi Vita Genic Jelly Mask Vitamin (30ml),-,12500,"Đã bán 10,9k",TP. Hồ Chí Minh,,₫,12900,,https://down-vn.img.susercontent.com/file/vn-11134207-7r98o-ls2qz9dvupqcd8_tn
Kem dưỡng Olay 7 in 1 bản uk ban ngày và ban đêm cao cấp,-,125000,Đã bán 34,Hà Nội,,₫,235000,Giảm ₫10k,https://down-vn.img.susercontent.com/file/vn-11134207-7qukw-li71ukbrsfde94_tn
Kem dưỡng trắng da tối ưu Hada Labo Perfect White Tranexamic Acid Cream 50g,240000,203000,"Đã bán 41,4k",TP. Hồ Chí Minh,,,,Giảm ₫15k,https://down-vn.img.susercontent.com/file/65b1372939e569e7d34a4dd2546b0f65_tn
Papa recipe Niacinamide Zinc Serum (150ml) & Huyết Thanh (30ml),,327270,Đã bán 734,Hàn Quốc,,,,60% Giảm,https://down-vn.img.susercontent.com/file/d8dea2a2d41c66d64101a8aeaca73cdb_tn
Mặt nạ cấp ẩm dưỡng trắng da BNBG Mask 30ml,-,17000,"Đã bán 301,5k",TP. Hồ Chí Minh,,₫,29000,,https://down-vn.img.susercontent.com/file/3618317c063f736f9b0f28a78da31d6b_tn
Sữa rửa mặt 3-trong-1 giảm mụn & sáng da Garnier Bright Complete Anti-Acne Foam 100ml,119000,102000,Đã bán 19k,TP. Hồ Chí Minh,Mua để nhận quà,,,Giảm ₫10k,https://down-vn.img.susercontent.com/file/vn-11134207-7qukw-lijykai6gyks5f_tn
Dưỡng chất ban đêm sáng da ngừa thâm Garnier 10% Vitamin C Bright Complete Overnight Serum 30ml,349000,289000,"Đã bán 10,1k",TP. Hồ Chí Minh,Mua để nhận quà,,,10% Giảm,https://down-vn.img.susercontent.com/file/vn-11134201-7r98o-lmxb3nzk9l277b_tn
Hộp 12 gói mặt nạ cà rốt sủi bọt làm sạch bụi bẩn giảm mụn đầu đen dưỡng da P0533,-,5500,"Đã bán 44,3k",Hà Nội,,₫,12000,,https://down-vn.img.susercontent.com/file/vn-11134207-7r98o-ls2qz9dvupqcd8_tn
Mặt Nạ Bùn Dạng Kem Làm Sạch Sâu (100ml),272727,210000,"Đã bán 5,7k",Hàn Quốc,,,,60% Giảm,https://down-vn.img.susercontent.com/file/vn-11134207-7qukw-li71ukbrsfde94_tn
Sữa Rửa Mặt Tạo Bọt Tơ Tằm Dưỡng Ẩm Làm Sạch Sâu Cỏ Mềm 150ml,150000,95000,Đã bán 38k,Hà Nội,Mua để nhận quà,,,,https://down-vn.img.susercontent.com/file/65b1372939e569e7d34a4dd2546b0f65_tn
"Kem dưỡng ẩm HOBEBAR 55ml sáng da nâng tone tức thì, siêu phục hồi dưỡng ẩm mờ thâm kiểm soát dầu thừa, ngừa mụn trở lại",76000,45000,Đã bán 3k,TP. Hồ Chí Minh,Mua Kèm Deal Sốc,,,Giảm ₫6k,https://down-vn.img.susercontent.com/file/d8dea2a2d41c66d64101a8aeaca73cdb_tn
Sữa rửa mặt sáng da L'Oreal Paris Glycolic (AHA) Bright 100ml,139000,122000,"Đã bán 28,6k",TP. Hồ Chí Minh,Mua để nhận quà,,,10% Giảm,https://down-vn.img.susercontent.com/file/vn-11134207-7r98o-ls3nfiyrek78a3_tn
Combo Simple Tẩy trang Micellar 200ml + Sữa rửa mặt 150ml + Nước hoa hồng 200ml ngừa mụn hiệu quả [CHÍNH HÃNG ĐỘC QUYỀN],399000,223000,"Đã bán 73,6k",TP. Hồ Chí Minh,Mua Kèm Deal Sốc,,,,https://down-vn.img.susercontent.com/file/vn-11134207-7r98o-lrx5kgl1md387d_tn
"Mặt Nạ BANOBAGI Bổ Sung Vitamin, Tái Tạo Làn Da Sáng Ngời Victa Genic 30ml_1 Miếng Lẻ",-,12900,"Đã bán 9,3k",TP. Hồ Chí Minh,,₫,15000,,https://down-vn.img.susercontent.com/file/vn-11134207-7r98o-lqy60dbyukec9a_tn
Gel Giảm Mụn Và Thâm Cafuné Essence 15gram,-,138000,"Đã bán 70,3k",TP. Hồ Chí Minh,,₫,208000,3% Giảm,https://down-vn.img.susercontent.com/file/23c72d10bcb3a99e5562fd5a461c88c6_tn
Tinh chất The Ordinary Niacinamide 10% + Zinc 1% giảm mụn giảm thâm,-,185000,"Đã bán 307,7k",TP. Hồ Chí Minh,,₫,320000,,https://down-vn.img.susercontent.com/file/vn-11134207-7qukw-lj0td18nflxuf4_tn
"Kem rửa mặt cho da mụn, nhạy cảm Hada Labo Acne Care Calming Cleanser 80g",95000,86000,"Đã bán 12,6k",TP. Hồ Chí Minh,,,,,https://down-vn.img.susercontent.com/file/vn-11134207-7r98o-lqu5vdqnaa4y78_tn
Dưỡng chất ban ngày làm sáng da [Vitamin C + Niacinamide] Garnier Bright Comple Booster Serum 30ml,279000,258000,"Đã bán 85,2k",TP. Hồ Chí Minh,Mua để nhận quà,,,10% Giảm,https://down-vn.img.susercontent.com/file/vn-11134207-7r98o-ls1lb0ln7hqx45_tn
Mặt Nạ Phục Hồi Và Cấp Ẩm Da Yuejin Mask 25ml,-,12900,"Đã bán 5,5k",TP. Hồ Chí Minh,,₫,18000,,https://down-vn.img.susercontent.com/file/cn-11134207-7r98o-lokxja96v13u61_tn
Kem dưỡng hỗ trợ làm dịu & phục hồi da La Roche-Posay Cicaplast Baume B5+ 100ml,635000,599000,"Đã bán 23,6k",TP. Hồ Chí Minh,,,,6% Giảm,https://down-vn.img.susercontent.com/file/vn-11134207-7qukw-lgxawf3i6rxv09_tn
Miếng Dán Lột Mụn Mũi Lanbena 30g Chăm Sóc Da Hiệu Quả (WITH FREE PAPER),156000,68000,"Đã bán 66,7k",Nước ngoài,Mua Kèm Deal Sốc,,,5% Giảm,https://down-vn.img.susercontent.com/file/vn-11134207-7r98o-lrwwadptvikk77_tn
"Sữa rửa mặt Cerave Foaming Cleanser, CeraVe Hydrating Cleanser, SA Cleanser cho mọi loại da 88ml, 236ml, 473ml",-,285000,"Đã bán 9,4k",Hà Nội,,₫,445000,Giảm ₫5k,https://down-vn.img.susercontent.com/file/vn-11134207-7r98o-lr78ngc942vt4f_tn
Kem Dưỡng Ẩm Chuyên Sâu Với Coenzym Q10 Ngừa Lão Hoá Da Tơ Tằm Cỏ Mềm 50g,,315000,"Đã bán 19,9k",Hà Nội,,,,Giảm ₫20k,https://down-vn.img.susercontent.com/file/vn-11134207-7r98o-lpzxb8jiv9yv23_tn
"Gel Rửa Mặt Cosrx Tràm Trà, 0.5% BHA Độ pH Thấp Low pH Good Morning Gel Cleanser 150ml Hasaki Sản Phẩm Chính Hãng",200000,132000,"Đã bán 34,5k",TP. Hồ Chí Minh,,,,,https://down-vn.img.susercontent.com/file/vn-11134207-7r98o-lqu0k9cgm1g2a2_tn
Kem dưỡng ẩm Embryolisse giúp phục hồi da Lait Crème Concentré Tuýp 30ml - 75ml,-,260000,"Đã bán 11,7k",Hà Nội,,₫,380000,,https://down-vn.img.susercontent.com/file/vn-11134207-7qukw-ljhxtw7zzhfmbd_tn
CODE Kem Lanolin Dưỡng Ẩm Chăm Sóc Da Khô Giúp Làm Trắng Kiểm Soát Dầu,17000,8900,"Đã bán 13,4k",Nước ngoài,,,,,https://down-vn.img.susercontent.com/file/d0eaa8cd5feedc893992bb358ddf639f_tn
"Bột đậu đỏ [ 1KG ] nguyên chất 100% Organic - Tắm trắng da, dưỡng ẩm, mờ thâm, tẩy TBC",-,75000,"Đã bán 56,9k",TP. Hồ Chí Minh,Mua để nhận quà,₫,125000,Giảm ₫10k,https://down-vn.img.susercontent.com/file/vn-11134207-7r98o-lrs1u32e0bkp1f_tn
Sữa Chống Nắng Dưỡng Trắng Sunplay Skin Aqua Clear White Cho Da Dầu SPF50+ PA++++ (25g/55g),290000,175000,"Đã bán 16,7k",TP. Hồ Chí Minh,Mua Kèm Deal Sốc,,,,https://down-vn.img.susercontent.com/file/3618317c063f736f9b0f28a78da31d6b_tn
Tẩy da chết Rosette Gommage Peeling Gel 120g,-,79000,"Đã bán 26,4k",TP. Hồ Chí Minh,Mua Kèm Deal Sốc,₫,135000,,https://down-vn.img.susercontent.com/file/vn-11134207-7qukw-lijykai6gyks5f_tn
"Kem Dưỡng Ẩm Ban Đêm Căng Mướt, Sáng Khỏe & Ngăn Lão Hóa OLAY REGENERIST 50G",499000,369000,"Đã bán 29,8k",TP. Hồ Chí Minh,,,,6% Giảm,https://down-vn.img.susercontent.com/file/vn-11134201-7r98o-lmxb3nzk9l277b_tn
Kem dưỡng siêu cấp ẩm căng mượt da và giảm nếp nhăn L'Oreal Paris Revitalift Hyaluronic Acid 50ml,359000,294000,"Đã bán 24,6k",TP. Hồ Chí Minh,Mua để nhận quà,,,10% Giảm,https://down-vn.img.susercontent.com/file/vn-11134207-7r98o-ls2qz9dvupqcd8_tn
"Kem dưỡng trắng da, hỗ trợ làn da lão hoá Forencos mini ban ngày và đêm 10ml/ 15ml",-,125000,Đã bán 13k,TP. Hồ Chí Minh,,₫,365000,10% Giảm,https://down-vn.img.susercontent.com/file/vn-11134207-7qukw-li71ukbrsfde94_tn
CODE Gel dưỡng ẩm chiết xuất lô hội hỗ trợ giảm mụn chăm sóc da,8000,5000,Đã bán 1k,Nước ngoài,,,,,https://down-vn.img.susercontent.com/file/65b1372939e569e7d34a4dd2546b0f65_tn
"Sữa Rửa Mặt Nghệ Nhân Sâm MELA Góp Phần Ngăn Ngừa Mụn, Hỗ Trợ Làm Sáng Da 200ml - ML08",,180000,"Đã bán 59,9k",Hà Nội,,,,,https://down-vn.img.susercontent.com/file/d8dea2a2d41c66d64101a8aeaca73cdb_tn
Senana Toner 120ml Làm Trắng Dưỡng Ẩm Thu Nhỏ Lỗ Chân Lông Kiểm Soát Dầu Chăm Sóc Da Mặt Nước hoa hồng Toner Niacinamide A225,20000,14500,"Đã bán 2,1k",Nước ngoài,,,,,https://down-vn.img.susercontent.com/file/3618317c063f736f9b0f28a78da31d6b_tn
"Mặt Nạ Giấy Cấp Ẩm, Dưỡng Trắng Da Nature Republic Real Nature Mask Sheet 23ml",-,13000,"Đã bán 26,8k",TP. Hồ Chí Minh,,₫,15000,,https://down-vn.img.susercontent.com/file/vn-11134207-7qukw-lijykai6gyks5f_tn
Kem ngày dưỡng sáng mờ thâm nám L'Oreal Paris Glycolic (AHA) Bright SPF 17 50ml,329000,286000,"Đã bán 14,6k",TP. Hồ Chí Minh,Mua để nhận quà,,,10% Giảm,https://down-vn.img.susercontent.com/file/vn-11134201-7r98o-lmxb3nzk9l277b_tn
Tinh Chất vitamin c hyaluronic acid 1.5ml Làm Trắng Dưỡng Ẩm Chống Lão Hóa Cho Da,,2000,Đã bán 874,Nước ngoài,,,,,https://down-vn.img.susercontent.com/file/vn-11134207-7r98o-ls2qz9dvupqcd8_tn
"Derma Forte Giảm Thâm Mụn, Dưỡng trắng mịn da - Bản Thường và bản Advanced - Bác Sĩ Mã Phượng",-,90000,"Đã bán 103,3k",Hà Nội,,₫,95000,Giảm ₫99k,https://down-vn.img.susercontent.com/file/vn-11134207-7qukw-li71ukbrsfde94_tn
Mặt nạ Banobagi dưỡng da bổ sung Vitamin Vita Genic Jelly Mask Giấy Stemcell BANOBAGI dưỡng ẩm 30ml,-,11000,"Đã bán 53,8k",Hà Nội,,₫,14500,,https://down-vn.img.susercontent.com/file/65b1372939e569e7d34a4dd2546b0f65_tn
Combo da mụn Gel giảm mụn Actidem Derma Gel 18g + Gel rửa mặt Actidem Derma pH 150ml/ Derma Gel 40g/ Derma Extra 18g,-,125000,"Đã bán 23,6k",TP. Hồ Chí Minh,,₫,209000,,https://down-vn.img.susercontent.com/file/d8dea2a2d41c66d64101a8aeaca73cdb_tn
Sữa Rửa Mặt Senka Perfect Whip 100G & 120G,-,69000,"Đã bán 33,8k",Hà Nội,Mua Kèm Deal Sốc,₫,79000,Giảm ₫10k,https://down-vn.img.susercontent.com/file/vn-11134207-7r98o-ls3nfiyrek78a3_tn
Sữa rửa mặt làm sạch & tẩy tế bào chết dịu nhẹ CeraVe SA Smoothing Cleanser 236ml,,320000,"Đã bán 3,2k",TP. Hồ Chí Minh,Mua để nhận quà,,,10% Giảm,https://down-vn.img.susercontent.com/file/vn-11134207-7r98o-lrx5kgl1md387d_tn
Kem Chống Nắng Dưỡng Trắng Nâng Tone Da Cell Fusion C Brightening Tone Up Sunscreen 100 SPF50+/PA ++++,-,349000,"Đã bán 8,5k",TP. Hồ Chí Minh,,₫,499000,10% Giảm,https://down-vn.img.susercontent.com/file/vn-11134207-7r98o-lqy60dbyukec9a_tn
Serum B5 PrettySkin Hydra Tinh Chất Phục Hồi Da Hàn Quốc 50ml Giúp Dưỡng Trắng Phục Hồi Da,300000,150000,Đã bán 8,Hà Nội,,,,Giảm ₫8k,https://down-vn.img.susercontent.com/file/23c72d10bcb3a99e5562fd5a461c88c6_tn
"HÀNG SẴN [20g]Kem giảm mụn, làm trắng da Acne Derm 20% Azelaic(Acnederm)",,200000,"Đã bán 25,9k",Hà Nội,,,,,https://down-vn.img.susercontent.com/file/vn-11134207-7qukw-lj0td18nflxuf4_tn
"✅[CHÍNH HÃNG] Neostrata Peel Tái Tạo Da, Giảm Nếp Nhăn Ngăn Ngừa Lão Hóa Prosystem Retinol Peel 1.5ml",650000,259000,"Đã bán 7,1k",TP. Hồ Chí Minh,,,,Giảm ₫2k,https://down-vn.img.susercontent.com/file/vn-11134207-7r98o-lqu5vdqnaa4y78_tn
"Kem dưỡng da Dear, Klairs Midnight Blue Calming Cream 60g",575000,402500,"Đã bán 38,1k",Hà Nội,,,,,https://down-vn.img.susercontent.com/file/vn-11134207-7r98o-ls1lb0ln7hqx45_tn
Sữa Rửa Mặt Cetaphil Gentle Skin Cleanser 500ml,-,139000,"Đã bán 27,6k",Hà Nội,Mua Kèm Deal Sốc,₫,329000,,https://down-vn.img.susercontent.com/file/cn-11134207-7r98o-lokxja96v13u61_tn
Sữa Chống Nắng Hàng Ngày Dưỡng Trắng Cho Da Dầu Sunplay Skin Aqua Clear White SPF50 25g - 55g,-,99000,"Đã bán 65,7k",Hà Nội,Mua để nhận quà,₫,179000,,https://down-vn.img.susercontent.com/file/vn-11134207-7qukw-lgxawf3i6rxv09_tn
Bộ kem ngày đêm sáng da tức thì Glycolic Bright & 2 Serum cấp ẩm L'Oreal Paris,1018000,546000,"Đã bán 15,5k",TP. Hồ Chí Minh,,,,10% Giảm,https://down-vn.img.susercontent.com/file/vn-11134207-7r98o-lrwwadptvikk77_tn
Mặt nạ giấy Banobagi dưỡng da bổ sung vitamin nuôi dưỡng tái tạo da mờ thâm cấp ẩm 30ml - HUNOXA,25000,15000,"Đã bán 3,6k",TP. Hồ Chí Minh,,,,,https://down-vn.img.susercontent.com/file/vn-11134207-7r98o-lr78ngc942vt4f_tn
Nước Hoa Hồng Không Mùi Dưỡng Ẩm Và Làm Mềm Da Dear Klairs Supple Preparation Unscented Toner 180ml,-,79000,"Đã bán 92,2k",TP. Hồ Chí Minh,,₫,266000,,https://down-vn.img.susercontent.com/file/vn-11134207-7r98o-lpzxb8jiv9yv23_tn
Gel Giảm Mụn Ngừa Thâm Gamma Derma Forte Bản Thường / Advanced 15g,-,88000,"Đã bán 7,9k",TP. Hồ Chí Minh,,₫,98000,Giảm ₫10k,https://down-vn.img.susercontent.com/file/vn-11134207-7r98o-lqu0k9cgm1g2a2_tn
"Tinh chất Oh!Oh! 20% Niacinamide & 2% Acetyl Glucosamine dưỡng sáng da, giảm thâm nám",-,279000,Đã bán 4k,TP. Hồ Chí Minh,,₫,589000,,https://down-vn.img.susercontent.com/file/vn-11134207-7qukw-ljhxtw7zzhfmbd_tn
Gói sample Kem OHUI trắng hồng căng bóng dưỡng ẩm chuyên sâu 1ml,3000,2900,"Đã bán 11,2k",Hà Nội,,,,,https://down-vn.img.susercontent.com/file/d0eaa8cd5feedc893992bb358ddf639f_tn
Mặt nạ viên Vitamin Mask Bioaqua Cấp ẩm Se khít Lỗ chân lông Giảm thâm Kiềm dầu,-,1000,"Đã bán 167,9k",Hà Nội,,₫,2590,,https://down-vn.img.susercontent.com/file/vn-11134207-7r98o-lrs1u32e0bkp1f_tn
[SAMPLE] Kem Dưỡng OHUI Miracle Moisture Ceramide Boosting Cream 1ml,,5000,"Đã bán 5,6k",Hà Nội,,,,,https://down-vn.img.susercontent.com/file/3618317c063f736f9b0f28a78da31d6b_tn
Miếng Dán Mụn FOCALSKIN Hút Mụn Sạch | Che Mụn Tự Nhiên | Giảm Sưng Mụn | 60 Miếng Ngày và Đêm Makeup Trang Điểm Che Mụn,99000,69000,"Đã bán 2,7k",TP. Hồ Chí Minh,Mua Kèm Deal Sốc,,,3% Giảm,https://down-vn.img.susercontent.com/file/vn-11134207-7qukw-lijykai6gyks5f_tn
Sữa rửa mặt dưỡng ẩm da innisfree Green Tea Amino Cleansing Foam 150g,280000,232400,"Đã bán 48,9k",TP. Hồ Chí Minh,Mua để nhận quà,,,Giảm ₫40k,https://down-vn.img.susercontent.com/file/vn-11134201-7r98o-lmxb3nzk9l277b_tn
[HB GIFT] Bộ 2 Mặt nạ ngủ dưỡng ẩm cho da Laneige Water Sleeping Mask 15mlx2,,400000,"Đã bán 22,9k",TP. Hồ Chí Minh,,,,10% Giảm,https://down-vn.img.susercontent.com/file/vn-11134207-7r98o-ls2qz9dvupqcd8_tn
"[HÀNG CHÍNH HÃNG]Miếng dán mụn, vết thương, sẹo, phỏng bô...đa năng Duoderm Extrathin",-,34900,"Đã bán 46,6k",TP. Hồ Chí Minh,Mua để nhận quà,₫,64400,,https://down-vn.img.susercontent.com/file/vn-11134207-7qukw-li71ukbrsfde94_tn
"Sữa Chống Nắng Sunplay Super Block SPF 81, PA++++ 70g",,82000,"Đã bán 12,9k",TP. Hồ Chí Minh,Mua Kèm Deal Sốc,,,,https://down-vn.img.susercontent.com/file/65b1372939e569e7d34a4dd2546b0f65_tn
[HB gift] Bộ 2 Kem chống nắng Laneige Radian-C Sun Cream SPF 50+ PA++++10ml x 2,,300000,Đã bán 8k,TP. Hồ Chí Minh,,,,5% Giảm,https://down-vn.img.susercontent.com/file/d8dea2a2d41c66d64101a8aeaca73cdb_tn
Mặt nạ nội địa trung Mivino dưỡng trắng da dưỡng ẩm cao cấp B89,2500,1950,"Đã bán 23,3k",Hà Nội,,,,,https://down-vn.img.susercontent.com/file/3618317c063f736f9b0f28a78da31d6b_tn
Kem làm dịu hồi phục da Avene Cicalfate Repair Cream (Pháp),-,240000,"Đã bán 113,7k",TP. Hồ Chí Minh,,₫,355000,,https://down-vn.img.susercontent.com/file/vn-11134207-7qukw-lijykai6gyks5f_tn
