Tensp,giatu,giaden,daban,diadiem,Column6,Column7,gia goc,giam,link
Mặt nạ giấy dưỡng da Hàn Quốc innisfree My Real Squeeze Mask 22ml,27000,23000,Đã bán 219k,TP. Hồ Chí Minh,,,,,https://down-vn.img.susercontent.com/file/3618317c063f736f9b0f28a78da31d6b_tn
"Mặt nạ nội địa trung cao cấp các loại, giúp cấp ẩm, trắng da, kiềm dầu, se khít lỗ chân lông",2000,1000,Đã bán 46k,TP. Hồ Chí Minh,Mua để nhận quà,,,,https://down-vn.img.susercontent.com/file/vn-11134207-7qukw-lijykai6gyks5f_tn
"Serum The Ordinary Niacinamide 10% + Zinc 1% 30ml, giảm mụn giảm thâm, se khít lỗ chân lông",-,169000,"Đã bán 25,8k",TP. Hồ Chí Minh,,₫,335000,,https://down-vn.img.susercontent.com/file/vn-11134201-7r98o-lmxb3nzk9l277b_tn
Tẩy da chết mặt cà phê Đắk Lắk Cocoon cho làn da mềm mại & rạng rỡ 150ml,,165000,"Đã bán 100,6k",TP. Hồ Chí Minh,,,,Giảm ₫20k,https://down-vn.img.susercontent.com/file/vn-11134207-7r98o-ls2qz9dvupqcd8_tn
Combo 10 Mặt Nạ Giấy BIOAQUA Trái Cây Dưỡng Da Trắng Sáng Cấp Ẩm Nước Giảm Mụn Mask Hoa Quả CHARM BEAUTY,-,14900,"Đã bán 5,8k",TP. Hồ Chí Minh,,₫,19500,,https://down-vn.img.susercontent.com/file/vn-11134207-7qukw-li71ukbrsfde94_tn
Mặt nạ giấy dưỡng trắng da mụn cấp ẩm thải độc HA Images - mn02,-,1000,"Đã bán 1,5tr",Hà Nội,Mua để nhận quà,₫,3500,,https://down-vn.img.susercontent.com/file/65b1372939e569e7d34a4dd2546b0f65_tn
"Gel Tẩy Da Chết, Tẩy Tế Bào Chết Mặt chiết xuất Nha Đam làm sạch sâu da sạch mịn tươi sáng",36000,18000,"Đã bán 2,6k",Nước ngoài,,,,3% Giảm,https://down-vn.img.susercontent.com/file/d8dea2a2d41c66d64101a8aeaca73cdb_tn
Mặt nạ đất sét BEPLAIN X LeoJ 120ml từ đậu xanh se khít lỗ chân lông giảm mụn đầu đen,590000,345000,"Đã bán 28,9k",Hàn Quốc,,,,15% Giảm,https://down-vn.img.susercontent.com/file/vn-11134207-7r98o-ls3nfiyrek78a3_tn
[BANOBAGI] Combo 10 Mặt Nạ Bổ Sung Vitamin Vita Genic BANOBAGI (30ml x 10),250000,135000,"Đã bán 7,9k",TP. Hồ Chí Minh,Mua Kèm Deal Sốc,,,,https://down-vn.img.susercontent.com/file/vn-11134207-7r98o-lrx5kgl1md387d_tn
Mặt Nạ Bổ Sung Vitamin Cho Da BANOBAGI Vita Mask 30g,-,13500,"Đã bán 53,4k",TP. Hồ Chí Minh,Mua Kèm Deal Sốc,₫,14500,,https://down-vn.img.susercontent.com/file/vn-11134207-7r98o-lqy60dbyukec9a_tn
CODE Gel tẩy tế bào chết dưỡng da tươi trẻ trắng sáng 60g tinh chất lô hội tự nhiên,15000,8900,"Đã bán 8,3k",Nước ngoài,,,,,https://down-vn.img.susercontent.com/file/23c72d10bcb3a99e5562fd5a461c88c6_tn
"Mặt nạ Banobagi dưỡng ẩm, bổ sung Vitamin Vita Genic Jelly Mask các loại ( Miếng lẻ ) 30g",,20000,"Đã bán 233,6k",Hà Nội,,,,,https://down-vn.img.susercontent.com/file/vn-11134207-7qukw-lj0td18nflxuf4_tn
Kem Chống Nắng Skin1004 Madagascar Centella Air-Fit Suncream Plus Loại 50ml,399000,115500,Đã bán 2k,Ninh Bình,,,,Giảm ₫10k,https://down-vn.img.susercontent.com/file/vn-11134207-7r98o-lqu5vdqnaa4y78_tn
"CÀ PHÊ ĐẮK LẮK LÀM SẠCH DA CHẾT CƠ THỂ COCOON (PHIÊN BẢN GIỚI HẠN) ""CHUNG TAY BẢO VỆ CHÓ MÈO"" 200ML",,125000,"Đã bán 3,2k",TP. Hồ Chí Minh,Mua để nhận quà,,,Giảm ₫10k,https://down-vn.img.susercontent.com/file/vn-11134207-7r98o-ls1lb0ln7hqx45_tn
"Mặt nạ dưỡng da, mặt nạ dưỡng trắng cấp ẩm mờ thâm bổ sung collagen tinh chất ốc sên Nội Địa Trung",-,1000,"Đã bán 2,1tr",Hà Nội,Mua Kèm Deal Sốc,₫,1999,,https://down-vn.img.susercontent.com/file/cn-11134207-7r98o-lokxja96v13u61_tn
"Mặt nạ nhau thai cừu cuống rốn tế bào gốc Nhật Bản Rwine Beauty dưỡng da, cung cấp độ ẩm, tái tạo collagen MN01",7000,3500,"Đã bán 752,2k",Hà Nội,Mua Kèm Deal Sốc,,,,https://down-vn.img.susercontent.com/file/vn-11134207-7qukw-lgxawf3i6rxv09_tn
"COMBO 10 Miếng Mặt Nạ BANOBAGI Thế Hệ Mới, Dưỡng Da Chuyên Sâu Dành Cho Mọi Loại Da 30ml (Vita Genic ,Vita Cocktail)",-,137000,"Đã bán 7,1k",Hà Nội,Mua để nhận quà,₫,258000,,https://down-vn.img.susercontent.com/file/vn-11134207-7r98o-lrwwadptvikk77_tn
"Mặt Nạ BANOBAGI PREMIUM Vita Genic Jelly Mask Hydrating giúp cấp ẩm, phục hồi da 30ml",-,14500,"Đã bán 12,9k",Hà Nội,Mua để nhận quà,₫,16000,,https://down-vn.img.susercontent.com/file/vn-11134207-7r98o-lr78ngc942vt4f_tn
"[CHÍNH HÃNG]Toner dưỡng ẩm, Nước cân bằng da Klairs 180ml không mùi, dưỡng ẩm tức thì – Nước hoa hồng dưỡng ẩm",409000,125000,"Đã bán 2,7k",Hà Nội,Mua Kèm Deal Sốc,,,Giảm ₫3k,https://down-vn.img.susercontent.com/file/vn-11134207-7r98o-lpzxb8jiv9yv23_tn
Mặt nạ đất sét HOBEBAR 55g làm sạch sâu se khít lỗ chân lông loại bỏ mụn đầu đen hiệu quả và làm khô vết nhân mụn mask,80000,48000,"Đã bán 1,7k",TP. Hồ Chí Minh,Mua Kèm Deal Sốc,,,Giảm ₫6k,https://down-vn.img.susercontent.com/file/vn-11134207-7r98o-lqu0k9cgm1g2a2_tn
"Nước Xịt khoáng Evoluderm Atomiseur Eau Pure chính hãng dưỡng ẩm, làm dịu da 400ml",295000,149000,"Đã bán 32,8k",TP. Hồ Chí Minh,Mua để nhận quà,,,Giảm ₫20k,https://down-vn.img.susercontent.com/file/vn-11134207-7qukw-ljhxtw7zzhfmbd_tn
Dầu dưỡng tóc L'Oreal Paris Elseve Extraordinary Oil 100ml,229000,220000,"Đã bán 61,8k",TP. Hồ Chí Minh,Mua để nhận quà,,,10% Giảm,https://down-vn.img.susercontent.com/file/d0eaa8cd5feedc893992bb358ddf639f_tn
Kem chống nắng x20 thoáng da mỏng nhẹ L'Oreal Paris UV Defender Serum 50ml SPF 50+,-,254000,"Đã bán 219,1k",TP. Hồ Chí Minh,Mua để nhận quà,₫,304000,10% Giảm,https://down-vn.img.susercontent.com/file/vn-11134207-7r98o-lrs1u32e0bkp1f_tn
Tinh chất ốc sên COSRX 96 Mucin 100ml / 20ml hỗ trợ tái tạo dưỡng ẩm cho da,-,328000,"Đã bán 19,3k",Hàn Quốc,,₫,665000,20% Giảm,https://down-vn.img.susercontent.com/file/3618317c063f736f9b0f28a78da31d6b_tn
Xịt Khoáng Cố Định Lớp Trang Điểm Dưỡng Ẩm Kiềm Dầu Lâu Trôi 100ml,36000,18800,"Đã bán 6,8k",Nước ngoài,Mua Kèm Deal Sốc,,,,https://down-vn.img.susercontent.com/file/vn-11134207-7qukw-lijykai6gyks5f_tn
hộp 50 miếng mặt nạ tế bào gốc NHẬT BẢN ( chính hãng date 2026),210000,105000,"Đã bán 21,2k",Hà Nội,,,,,https://down-vn.img.susercontent.com/file/vn-11134201-7r98o-lmxb3nzk9l277b_tn
[BANOBAGI] Mặt Nạ Bổ Sung Vitamin Vita Genic BANOBAGI 30ml,25000,13900,Đã bán 33k,TP. Hồ Chí Minh,Mua Kèm Deal Sốc,,,,https://down-vn.img.susercontent.com/file/vn-11134207-7r98o-ls2qz9dvupqcd8_tn
"Mặt nạ bùn đất sét BEUCLAY trà xanh sáng da, se khít lỗ chân lông, kiểm soát dầu, ngăn ngừa mụn cám mụn đầu đen",-,99000,"Đã bán 23,6k",TP. Hồ Chí Minh,Mua để nhận quà,₫,250000,3% Giảm,https://down-vn.img.susercontent.com/file/vn-11134207-7qukw-li71ukbrsfde94_tn
[MUA 1 HỘP TẶNG 1 MIẾNG] - Mặt Nạ Giấy COLORKEY LUMINOUS Vitamin B5 Cấp Ẩm PHIÊN BẢN NÂNG CẤP 10 miếng/hộp,208000,98000,"Đã bán 12,7k",TP. Hồ Chí Minh,,,,,https://down-vn.img.susercontent.com/file/65b1372939e569e7d34a4dd2546b0f65_tn
[Mã FMCGWA102 giảm 10% đơn 400K] Sữa Chống Nắng Dưỡng Da Anessa Perfect UV SPF50+/PA++++ 60ml,715000,399000,Đã bán 62k,Bình Dương,Mua để nhận quà,,,Giảm ₫25k,https://down-vn.img.susercontent.com/file/d8dea2a2d41c66d64101a8aeaca73cdb_tn
Combo siêu dưỡng HOBEBAR mặt nạ đất sét + kem dưỡng ẩm phục hồi cấp nước làm dịu da tức thì cải thiện hàng rào bảo vệ da,120000,62000,"Đã bán 1,3k",TP. Hồ Chí Minh,Mua để nhận quà,,,Giảm ₫6k,https://down-vn.img.susercontent.com/file/3618317c063f736f9b0f28a78da31d6b_tn
[COMBO 5 TẶNG 1]FOCALSKIN Mặt Nạ Giấy B5 RAU MÁ 5X Ceramide 5X Cấp Ẩm Phục Hồi Da Tổn Thương 25ml | Mask giấy dưỡng ẩm,-,28000,Đã bán 26k,Nước ngoài,Mua để nhận quà,₫,99000,,https://down-vn.img.susercontent.com/file/vn-11134207-7qukw-lijykai6gyks5f_tn
Mặt nạ Yuejin B5 Repair Control 25ml/miếng,-,15000,Đã bán 20k,TP. Hồ Chí Minh,Mua Kèm Deal Sốc,₫,25000,,https://down-vn.img.susercontent.com/file/vn-11134201-7r98o-lmxb3nzk9l277b_tn
Serum DELEVENTH arbutin glycyrrhiza glabra giảm thâm làm trắng sáng da kiềm dầu dưỡng ẩm và phục hồi da 37ml,168952,86800,"Đã bán 34,4k",Nước ngoài,,,,15% Giảm,https://down-vn.img.susercontent.com/file/vn-11134207-7r98o-ls2qz9dvupqcd8_tn
"Gel lột mụn Blackhead Mask, mặt nạ lột mụn không gây đau rát, kháng khuẩn, cân bằng da, chính hãng Hanseoul",-,78000,"Đã bán 14,9k",Hà Nội,,₫,155000,,https://down-vn.img.susercontent.com/file/vn-11134207-7qukw-li71ukbrsfde94_tn
Mặt Nạ Ngủ Laneige Water Sleeping Mask EX 70ml Dưỡng Ẩm Bảo Vệ Da,790000,620000,"Đã bán 26,1k",TP. Hồ Chí Minh,Mua Kèm Deal Sốc,,,10% Giảm,https://down-vn.img.susercontent.com/file/65b1372939e569e7d34a4dd2546b0f65_tn
Gel tẩy tế bào da chết Rosette Peeling Gel loại bỏ sợi bã nhờn cho da căng mịn Nhật Bản No.1 Cosme 120g,-,89000,Đã bán 24k,Hà Nội,,₫,128000,,https://down-vn.img.susercontent.com/file/d8dea2a2d41c66d64101a8aeaca73cdb_tn
Gel tẩy tế bào chết Rosette Peeling Gel Nhật Bản (No.1 Cosme),-,89000,"Đã bán 157,1k",Hà Nội,,₫,125000,,https://down-vn.img.susercontent.com/file/vn-11134207-7r98o-ls3nfiyrek78a3_tn
Cà phê Đắk Lắk làm sạch da mặt cocoon 150ml (Dak Lak coffee face polish),-,132000,"Đã bán 54,5k",TP. Hồ Chí Minh,Mua để nhận quà,₫,157600,Giảm ₫300k,https://down-vn.img.susercontent.com/file/vn-11134207-7r98o-lrx5kgl1md387d_tn
"Kem Chống Nắng Sunplay Skin Aqua Dưỡng Da Trắng Mịn, Chống Nước, Ngừa Mụn, Dưỡng Ẩm Cho Mọi Loại Da SPF 50+, PA+++++",-,85000,"Đã bán 20,4k",TP. Hồ Chí Minh,,₫,118000,,https://down-vn.img.susercontent.com/file/vn-11134207-7r98o-lqy60dbyukec9a_tn
HÀNG TẶNG KHÔNG BÁN - Tẩy da chết mặt cà phê Đắk Lắk Cocoon cho làn da mềm mại & rạng rỡ 150ml,,165000,Đã bán 9k,TP. Hồ Chí Minh,,,,Giảm ₫20k,https://down-vn.img.susercontent.com/file/23c72d10bcb3a99e5562fd5a461c88c6_tn
Mặt nạ tinh chất căng mướt da Garnier 28g,,29000,"Đã bán 25,9k",TP. Hồ Chí Minh,Mua để nhận quà,,,,https://down-vn.img.susercontent.com/file/vn-11134207-7qukw-lj0td18nflxuf4_tn
"Gel Nha Đam dưỡng ẩm 98% SIMU MMEI'R 300ml - Gel Lô Hội nội địa Trung dưỡng da, cấp ẩm cho da mặt",40000,25000,"Đã bán 46,2k",Hà Nội,Mua Kèm Deal Sốc,,,,https://down-vn.img.susercontent.com/file/vn-11134207-7r98o-lqu5vdqnaa4y78_tn
Sữa rửa mặt Simple lành tính sạch thoáng - cho da nhạy cảm 150ml [CHÍNH HÃNG ĐỘC QUYỀN] [DIỆN MẠO MỚI],132000,105000,"Đã bán 364,6k",TP. Hồ Chí Minh,Mua để nhận quà,,,,https://down-vn.img.susercontent.com/file/vn-11134207-7r98o-ls1lb0ln7hqx45_tn
Mặt Nạ Giấy Dưỡng Da Toàn Diện Foodaholic Mask (23g),-,9000,"Đã bán 48,9k",TP. Hồ Chí Minh,,₫,11000,,https://down-vn.img.susercontent.com/file/cn-11134207-7r98o-lokxja96v13u61_tn
"[Torriden Chính hãng] Serum số 1 DIVE IN Hyaluronic Acid cho da sáng bóng, dưỡng ẩm sâu, không bết dính, 50ml, 50ml+50ml",-,387200,Đã bán 53k,Hàn Quốc,,₫,736000,15% Giảm,https://down-vn.img.susercontent.com/file/vn-11134207-7qukw-lgxawf3i6rxv09_tn
"Kem Dưỡng Ẩm, Làm Sáng, Trẻ Hóa Da Mặt Reihaku Hatomugi Moisturizing & Conditioning Milky Cream 300g",210000,125000,"Đã bán 8,5k",Hà Nội,,,,,https://down-vn.img.susercontent.com/file/vn-11134207-7r98o-lrwwadptvikk77_tn
"Mặt Nạ Giấy HA Images - Dưỡng Trắng, Cấp Ẩm, Thải Độc, Se Khít Lỗ Chân Lông cho Da Mụn",4000,3500,"Đã bán 4,4k",Hải Phòng,,,,Giảm ₫15k,https://down-vn.img.susercontent.com/file/vn-11134207-7r98o-lr78ngc942vt4f_tn
Kem chống nắng Sunplay Skin Aqua Tone Up UV Lavender SPF50+ PA++++ 50g,250000,149000,"Đã bán 31,4k",TP. Hồ Chí Minh,Mua Kèm Deal Sốc,,,,https://down-vn.img.susercontent.com/file/vn-11134207-7r98o-lpzxb8jiv9yv23_tn
Mặt nạ dưỡng da Vita Genic Jelly Mask BANOBAGI 30ml,-,12500,"Đã bán 147,9k",Hà Nội,Mua Kèm Deal Sốc,₫,25000,,https://down-vn.img.susercontent.com/file/vn-11134207-7r98o-lqu0k9cgm1g2a2_tn
Kem mắt giảm thâm với Caffeine Peptides và chiết xuất cam thảo - Eye Serum The Originote 15gr,125000,77000,Đã bán 47k,TP. Hồ Chí Minh,,,,Giảm ₫5k,https://down-vn.img.susercontent.com/file/vn-11134207-7qukw-ljhxtw7zzhfmbd_tn
"Serum ngừa mụn, sáng da, se khít Niacinamide 10% + Zinc 1% - The Ordinary",230000,146000,"Đã bán 106,5k",TP. Hồ Chí Minh,Mua để nhận quà,,,15% Giảm,https://down-vn.img.susercontent.com/file/d0eaa8cd5feedc893992bb358ddf639f_tn
"Kem rửa mặt sạch sâu, dưỡng ẩm tối ưu Hada Labo Advanced Nourish Hyaluronic Acid Cleanser 80g (Trắng)",110000,67000,"Đã bán 21,1k",TP. Hồ Chí Minh,Mua Kèm Deal Sốc,,,,https://down-vn.img.susercontent.com/file/vn-11134207-7r98o-lrs1u32e0bkp1f_tn
"Sữa Rửa Mặt Simple Refreshing Facial Wash 150ml - Dịu Nhẹ Cho Da Dầu Mụn, Nhạy Cảm",-,39000,"Đã bán 48,8k",Hà Nội,,₫,92000,,https://down-vn.img.susercontent.com/file/3618317c063f736f9b0f28a78da31d6b_tn
"Mặt nạ giấy dưỡng ẩm, dưỡng trắng da Hàn Quốc Foodaholic Essential Mask 25ml",-,7900,"Đã bán 54,6k",Hà Nội,Mua Kèm Deal Sốc,₫,20000,,https://down-vn.img.susercontent.com/file/vn-11134207-7qukw-lijykai6gyks5f_tn
"Kem dưỡng da mặt nhau thai Seimy - Diamond Luxury dưỡng trắng , cấp ẩm, mờ nám, giảm mụn",179000,159000,"Đã bán 45,4k",Hà Nội,,,,Giảm ₫40k,https://down-vn.img.susercontent.com/file/vn-11134201-7r98o-lmxb3nzk9l277b_tn
Bộ Serum & Kem ngày & Kem đêm sáng da tức thì Glycolic Bright L'Oreal Paris,829000,382000,"Đã bán 76,3k",TP. Hồ Chí Minh,,,,10% Giảm,https://down-vn.img.susercontent.com/file/vn-11134207-7r98o-ls2qz9dvupqcd8_tn
[MUA COMBO TẶNG 3 MIẾNG] - Combo 3 Hộp 3 màu Mặt Nạ Giấy COLORKEY LUMINOUS Vitamin B5 10 miếng/hộp,618000,264000,"Đã bán 1,9k",TP. Hồ Chí Minh,,,,,https://down-vn.img.susercontent.com/file/vn-11134207-7qukw-li71ukbrsfde94_tn
"Kem Dưỡng Ẩm Cafuné Witch Hazel Moisture Cream The Cafuné Dưỡng Trắng, Dưỡng Ẩm Làm Đều Màu Da 40gr",-,158000,"Đã bán 6,1k",TP. Hồ Chí Minh,Mua để nhận quà,₫,280000,5% Giảm,https://down-vn.img.susercontent.com/file/65b1372939e569e7d34a4dd2546b0f65_tn
Gel giảm mụn và thâm Gamma SANTAGIFT thông thoáng lỗ chân lông 20g,180000,160000,"Đã bán 188,3k",TP. Hồ Chí Minh,,,,,https://down-vn.img.susercontent.com/file/d8dea2a2d41c66d64101a8aeaca73cdb_tn
"Serum ngừa mụn, sáng da, se khít Niacinamide 10% + Zinc 1% - The Ordinary",230000,146000,"Đã bán 106,5k",TP. Hồ Chí Minh,Mua để nhận quà,,,15% Giảm,https://down-vn.img.susercontent.com/file/3618317c063f736f9b0f28a78da31d6b_tn
Kem chống nắng nâng tone Smile Leader Sun Cream SPF50+ cho da dầu mụn và da khô 60ml | Mmall_vn,118000,69800,"Đã bán 12,7k",TP. Hồ Chí Minh,,,,,https://down-vn.img.susercontent.com/file/vn-11134207-7qukw-lijykai6gyks5f_tn
Nước Hoa Hồng Không Mùi Dưỡng Ẩm Da Và Làm Mềm Da Dear Klairs Supple Preparation Unscented Toner 180ml,385000,255000,"Đã bán 3,4k",Hà Nội,,,,Giảm ₫20k,https://down-vn.img.susercontent.com/file/vn-11134201-7r98o-lmxb3nzk9l277b_tn
"Nước Hoa Hồng Toner Hoa Cúc & AHA Ngừa Mụn, Giảm Dầu Dành Cho Da Dầu Mụn MILAGANICS 250ml (Chai)",-,40000,"Đã bán 86,8k",TP. Hồ Chí Minh,,₫,189000,50% Giảm,https://down-vn.img.susercontent.com/file/vn-11134207-7r98o-ls2qz9dvupqcd8_tn
"Kem Dưỡng Ẩm, Làm Sáng, Trẻ Hóa Da Mặt Reihaku Hatomugi Moisturizing & Conditioning Milky Cream 300g",199000,125000,"Đã bán 31,7k",Hà Nội,,,,,https://down-vn.img.susercontent.com/file/vn-11134207-7qukw-li71ukbrsfde94_tn
Sữa rửa mặt Simple giúp kiềm dầu và ngừa mụn hiệu quả - cho da dầu mụn 150ml [CHÍNH HÃNG ĐỘC QUYỀN] [DIỆN MẠO MỚI],132000,105000,Đã bán 231k,TP. Hồ Chí Minh,Mua để nhận quà,,,,https://down-vn.img.susercontent.com/file/65b1372939e569e7d34a4dd2546b0f65_tn
"Sữa rửa mặt Ý Dĩ Hatomugi dưỡng ẩm, trắng da Moisturizing & Facial Washing 170g",-,45000,"Đã bán 46,7k",Hà Nội,,₫,55000,,https://down-vn.img.susercontent.com/file/d8dea2a2d41c66d64101a8aeaca73cdb_tn
"Dưỡng chất cho da dầu mụn Garnier Bright Complete Anti-Acnes Booster Serum 4% [Niacinamide, BHA, AHA, Vitamin C] 30ml",329000,260000,"Đã bán 84,9k",TP. Hồ Chí Minh,Mua để nhận quà,,,10% Giảm,https://down-vn.img.susercontent.com/file/vn-11134207-7r98o-ls3nfiyrek78a3_tn
Serum DELEVENTH arbutin glycyrrhiza glabra giảm thâm làm trắng sáng da kiềm dầu dưỡng ẩm và phục hồi da 37ml,168952,86800,"Đã bán 34,4k",Nước ngoài,,,,15% Giảm,https://down-vn.img.susercontent.com/file/vn-11134207-7r98o-lrx5kgl1md387d_tn
Mặt nạ Yuejin B5 Repair Control EGF Cấp ẩm phục hồi da (25ml),-,14000,"Đã bán 88,8k",TP. Hồ Chí Minh,Mua để nhận quà,₫,26000,50% Giảm,https://down-vn.img.susercontent.com/file/vn-11134207-7r98o-lqy60dbyukec9a_tn
Serum dạng xịt khoáng căng bóng da First Spray Serum 50ml/100ml,-,304000,"Đã bán 1,5k",Hà Nội,,₫,485000,,https://down-vn.img.susercontent.com/file/23c72d10bcb3a99e5562fd5a461c88c6_tn
(CẢNH BÁO FAKE ĐÃ CÓ LOGO) [Phân biệt Auth - Fake] Kem dưỡng Redwin Vitamin E Cream 300g Úc chính hãng,115000,95000,"Đã bán 28,5k",Hà Nội,Mua Kèm Deal Sốc,,,,https://down-vn.img.susercontent.com/file/vn-11134207-7qukw-lj0td18nflxuf4_tn
"Sữa chống nắng hằng ngày dưỡng trắng cho da dầu Sunplay Skin Aqua Clear White SPF 50, PA++++ 25g",119000,105000,"Đã bán 55,3k",TP. Hồ Chí Minh,Mua để nhận quà,,,Giảm ₫10k,https://down-vn.img.susercontent.com/file/vn-11134207-7r98o-lqu5vdqnaa4y78_tn
Combo Simple Tẩy trang 200ml + Sữa rửa mặt 150ml + Nước hoa hồng 200ml cho da sạch khỏe đàn hồi [CHÍNH HÃNG ĐỘC QUYỀN],399000,223000,"Đã bán 94,3k",TP. Hồ Chí Minh,Mua Kèm Deal Sốc,,,,https://down-vn.img.susercontent.com/file/vn-11134207-7r98o-ls1lb0ln7hqx45_tn
Kem chống nắng nâng tông kiềm dầu innisfree Tone Up No Sebum Sunscreen EX SPF 50+ PA++++ 60 mL (New 2023),450000,427500,"Đã bán 12,7k",TP. Hồ Chí Minh,Mua để nhận quà,,,Giảm ₫50k,https://down-vn.img.susercontent.com/file/cn-11134207-7r98o-lokxja96v13u61_tn
Serum giảm mụn thâm rỗ Seimy - Skin 7 Days - Công dụng 5 trong 1 hiệu quả sau 7 ngày 10ml,179000,155000,"Đã bán 134,3k",Hà Nội,,,,Giảm ₫40k,https://down-vn.img.susercontent.com/file/vn-11134207-7qukw-lgxawf3i6rxv09_tn
[SKINFOOD] caroten cà rốt nguôi đi nước hoa hồng dạng miếng 250g (60ea) / làm dịu vết đỏ / làm mát da nóng / thành phần tự nhiên / Carrot Carotene Calming Water Pad,598728,386000,"Đã bán 3,5k",Hàn Quốc,,,,10% Giảm,https://down-vn.img.susercontent.com/file/vn-11134207-7r98o-lrwwadptvikk77_tn
(Quà tặng) Tinh chất dưỡng ẩm INNISFREE Green Tea Seed Hyaluronic Serum 10mL,,90000,"Đã bán 8,3k",TP. Hồ Chí Minh,,,,,https://down-vn.img.susercontent.com/file/vn-11134207-7r98o-lr78ngc942vt4f_tn
"Kem Chống Nắng Dưỡng Da, Ngừa Mụn Skin1004 Madagascar Centella Air-fit Suncream Plus SPF50+ PA++++ (50ml/20ml)",-,125000,"Đã bán 10,2k",TP. Hồ Chí Minh,Mua Kèm Deal Sốc,₫,276000,,https://down-vn.img.susercontent.com/file/vn-11134207-7r98o-lpzxb8jiv9yv23_tn
Kem Dưỡng Ẩm Cấp Nước Neutrogena Hydro Boost Water Gel Mini 15g,150000,97000,"Đã bán 19,1k",TP. Hồ Chí Minh,Mua Kèm Deal Sốc,,,,https://down-vn.img.susercontent.com/file/vn-11134207-7r98o-lqu0k9cgm1g2a2_tn
Mặt Nạ Giấy Dưỡng Da Toàn Diện Foodaholic Mask (23g),-,9000,"Đã bán 48,9k",TP. Hồ Chí Minh,,₫,11000,,https://down-vn.img.susercontent.com/file/vn-11134207-7qukw-ljhxtw7zzhfmbd_tn
Combo Sữa Rửa Mặt và Gel giảm mụn và thâm Gamma SANTAGIFT 80g và 20g,,280000,"Đã bán 8,1k",TP. Hồ Chí Minh,,,,,https://down-vn.img.susercontent.com/file/d0eaa8cd5feedc893992bb358ddf639f_tn
"Mặt nạ giấy dưỡng ẩm, dưỡng trắng da Hàn Quốc Foodaholic Essential Mask 25ml",-,7900,"Đã bán 54,6k",Hà Nội,Mua Kèm Deal Sốc,₫,20000,,https://down-vn.img.susercontent.com/file/vn-11134207-7r98o-lrs1u32e0bkp1f_tn
60 Miếng mặt nạ giảm mụn đầu đen LANBENA làm sạch sâu cho da dầu 30g,94000,68000,Đã bán 32k,Nước ngoài,Mua để nhận quà,,,5% Giảm,https://down-vn.img.susercontent.com/file/3618317c063f736f9b0f28a78da31d6b_tn
"Gel Nha Đam dưỡng ẩm 98% SIMU MMEI'R 300ml - Gel Lô Hội nội địa Trung dưỡng da, cấp ẩm cho da mặt",40000,25000,"Đã bán 46,2k",Hà Nội,Mua Kèm Deal Sốc,,,,https://down-vn.img.susercontent.com/file/vn-11134207-7qukw-lijykai6gyks5f_tn
SOUG Gel Tẩy Tế Bào Chết Làm Trắng Da Chiết Xuất Cam GMEELAN,84100,49900,"Đã bán 3,5k",Nước ngoài,,,,Giảm ₫4k,https://down-vn.img.susercontent.com/file/vn-11134201-7r98o-lmxb3nzk9l277b_tn
Tinh chất chống nắng hiệu chỉnh sắc da Sunplay Skin Aqua Tone Up UV Essence SPF50+ PA++++ 50g - Lavender MEOW COLLECTION,185000,163000,"Đã bán 125,9k",TP. Hồ Chí Minh,Mua để nhận quà,,,Giảm ₫10k,https://down-vn.img.susercontent.com/file/vn-11134207-7r98o-ls2qz9dvupqcd8_tn
Serum The Ordinary Cấp ẩm hồi phục Hyaluronic Acid 2% + B5,230000,175000,Đã bán 27k,TP. Hồ Chí Minh,Mua để nhận quà,,,15% Giảm,https://down-vn.img.susercontent.com/file/vn-11134207-7qukw-li71ukbrsfde94_tn
Kem chống nắng PESTLO Safe Recipe Sun Essence SPF50 PA++++ 50ml,-,118000,"Đã bán 5,9k",Hà Nội,Mua để nhận quà,₫,279000,,https://down-vn.img.susercontent.com/file/65b1372939e569e7d34a4dd2546b0f65_tn
Kem dưỡng ẩm sáng da hoa anh đào đảo Jeju innisfree Cherry Blossom Tone Up Cream 50ml,500000,460000,"Đã bán 21,6k",TP. Hồ Chí Minh,Mua để nhận quà,,,Giảm ₫50k,https://down-vn.img.susercontent.com/file/d8dea2a2d41c66d64101a8aeaca73cdb_tn
Mặt nạ đất sét Compliment 80ml,-,20000,"Đã bán 2,1k",TP. Hồ Chí Minh,,₫,99000,,https://down-vn.img.susercontent.com/file/3618317c063f736f9b0f28a78da31d6b_tn
Nước hoa hồng BadSkin Hyaluronic Spa Toner 500ml,500000,295000,"Đã bán 5,2k",Nghệ An,Mua Kèm Deal Sốc,,,Giảm ₫3k,https://down-vn.img.susercontent.com/file/vn-11134207-7qukw-lijykai6gyks5f_tn
"Bột ủ trắng đậu đỏ sữa non Obaxua nguyên chất sạch mịn - Giúp dưỡng trắng, cấp ẩm làm sạch sâu cho body",50000,29000,"Đã bán 27,4k",TP. Hồ Chí Minh,Mua để nhận quà,,,,https://down-vn.img.susercontent.com/file/vn-11134201-7r98o-lmxb3nzk9l277b_tn
"[Torriden Chính hãng] Set serum chăm sóc da căng bóng mịn số 1 DIVE IN Hyaluronic Acid, dưỡng ẩm sâu bên trong da, không bết dính, 50ml+50ml, 1 set",968000,736000,"Đã bán 17,3k",Hàn Quốc,,,,15% Giảm,https://down-vn.img.susercontent.com/file/vn-11134207-7r98o-ls2qz9dvupqcd8_tn
"Mặt nạ bùn đất sét BEUCLAY trà xanh sáng da, se khít lỗ chân lông, kiểm soát dầu, ngăn ngừa mụn cám mụn đầu đen",-,99000,"Đã bán 6,2k",Hà Nội,Mua để nhận quà,₫,239000,3% Giảm,https://down-vn.img.susercontent.com/file/vn-11134207-7qukw-li71ukbrsfde94_tn
Kem chống nắng Skin1004 Madagascar Centella Airfit Suncream Plus SPF50+ PA++++ 50ml,-,119000,"Đã bán 39,3k",TP. Hồ Chí Minh,Mua Kèm Deal Sốc,₫,344000,,https://down-vn.img.susercontent.com/file/65b1372939e569e7d34a4dd2546b0f65_tn
SỮA RỬA MẶT SIMPLE GIÚP DƯỠNG ẨM CHO DA TRÔNG KHỎE VÀ MỊN MÀNG 150ML [CHÍNH HÃNG ĐỘC QUYỀN] [DIỆN MẠO MỚI],132000,105000,"Đã bán 58,8k",TP. Hồ Chí Minh,Mua để nhận quà,,,,https://down-vn.img.susercontent.com/file/d8dea2a2d41c66d64101a8aeaca73cdb_tn
Sữa Rửa Mặt Compliment No Problem ngăn ngừa mụn sạch sâu 200ml,-,119000,"Đã bán 5,2k",TP. Hồ Chí Minh,Mua để nhận quà,₫,140000,,https://down-vn.img.susercontent.com/file/vn-11134207-7r98o-ls3nfiyrek78a3_tn
Sữa Chống Nắng Sáng Hồng Biore 30ml Tặng Nước tẩy trang Biore 25ml,102000,61000,"Đã bán 1,2k",TP. Hồ Chí Minh,,,,,https://down-vn.img.susercontent.com/file/vn-11134207-7r98o-lrx5kgl1md387d_tn
"Mặt Nạ Giấy FOODAHOLIC Mask 23g (1 miếng) Chăm Sóc Da Toàn Diện Dưỡng Ẩm, Dưỡng Trắng Da Hàn Quốc",-,9000,"Đã bán 17,3k",Hà Nội,,₫,13900,,https://down-vn.img.susercontent.com/file/vn-11134207-7r98o-lqy60dbyukec9a_tn
"Mặt nạ collage cấp ẩm mờ thâm, mặt nạ dưỡng da làm da mềm mịn cải thiện làn da khoẻ mạnh nội địa trung BIG SALE MART M18",2500,1900,Đã bán 53k,Hà Nội,,,,,https://down-vn.img.susercontent.com/file/23c72d10bcb3a99e5562fd5a461c88c6_tn
Kem Rửa Mặt Dưỡng Ẩm Hada Labo Advanced Nourish Hyaluronic Acid Cleanser 80gr,79000,67000,"Đã bán 58,5k",Hà Nội,,,,10% Giảm,https://down-vn.img.susercontent.com/file/vn-11134207-7qukw-lj0td18nflxuf4_tn
Papa Kem Chống Nắng Chiết Xuất Tràm Trà 50ml,327273,210000,"Đã bán 3,4k",Hàn Quốc,,,,60% Giảm,https://down-vn.img.susercontent.com/file/vn-11134207-7r98o-lqu5vdqnaa4y78_tn
